{"tannen":"corpus/1","vertical":"alpha","pipeline":"pipelines.alpha:run","authorisation":"decisions/0300-renavon-first-contact.yaml","items":[{"id":"i-001","input":"sha256:aaaaaaaaaaaaaaaaaaaaaaaaaaaaaaaaaaaaaaaaaaaaaaaaaaaaaaaaaaaaaaaa","production_output":"sha256:bbbbbbbbbbbbbbbbbbbbbbbbbbbbbbbbbbbbbbbbbbbbbbbbbbbbbbbbbbbbbbbb"},{"id":"i-002","input":"sha256:cccccccccccccccccccccccccccccccccccccccccccccccccccccccccccccccc","production_output":"sha256:bbbbbbbbbbbbbbbbbbbbbbbbbbbbbbbbbbbbbbbbbbbbbbbbbbbbbbbbbbbbbbbb"}]}
